{
  "$schema": "https://json-schema.org/draft/2020-12/schema",
  "additionalProperties": false,
  "properties": {
    "artifact_id": {
      "const": "V0_OSAP_GATE3_CLUSTER_B_WP5_SYNC_HELPER_REPAIR_FIXTURE_MANIFEST"
    },
    "date": {
      "const": "2026-07-24"
    },
    "fixture_count": {
      "const": 5
    },
    "fixtures": {
      "items": {
        "additionalProperties": false,
        "properties": {
          "expected_allowed": {
            "type": "boolean"
          },
          "fixture_id": {
            "type": "string"
          },
          "path": {
            "type": "string"
          },
          "sha256": {
            "pattern": "^[0-9a-f]{64}$",
            "type": "string"
          }
        },
        "required": [
          "fixture_id",
          "path",
          "sha256",
          "expected_allowed"
        ],
        "type": "object"
      },
      "maxItems": 5,
      "minItems": 5,
      "type": "array"
    },
    "version": {
      "const": "0.1"
    }
  },
  "required": [
    "artifact_id",
    "version",
    "date",
    "fixture_count",
    "fixtures"
  ],
  "type": "object"
}
